{
  "schema_version": "1.0.0",
  "record_type": "openai_ten_proofs_sphere_packing_route_proposal_registry",
  "registry_id": "MC-OTP-A-SPHERE-PACKING-ROUTE-PROPOSAL-001",
  "candidate_id": "OPENAI-TEN-PROOFS-001",
  "tracker_issue": "https://github.com/grandchallenge/MATHCERT/issues/156",
  "authority": {
    "cert_replay_evidence_merge": "036646952651057deadc5c485ef9e80a086865cd",
    "cert_replay_evidence_record_blob": "5a2d17d158ee9e8b535de8ed0a1ed41612c5abd2",
    "global_registered_route_registry_blob": "2d17473b4731aa9d9c630b1e7777ad4bd794d993"
  },
  "proposal": {
    "result_family": "OTP-A-SPHERE-PACKING",
    "proposal_id": "MC-OTP-ROUTE-PROPOSAL-A-SPHERE-PACKING",
    "requested_route_id": "MC-ROUTE-OTP-A-SPHERE-PACKING",
    "path": "governance/result_family_route_proposal_successors/OTP-A-SPHERE-PACKING.json",
    "digest_algorithm": "git_blob_sha1",
    "digest": "e216cfc893a99d853ca798a68c46adbf013239ff"
  },
  "state": {
    "proposal_count": 1,
    "registered_route_count_created_by_this_operation": 0,
    "adjudication_count": 0,
    "cert_output_count": 0,
    "mathematical_target_proved_count": 0,
    "aggregate_route_count": 0
  },
  "scope": {
    "target_count": 4,
    "another_family_target_count": 0,
    "aggregate_route": false,
    "whole_chapter_equivalence": false,
    "proof_body_equivalence": false,
    "source_authored_30_decimal_precision": false,
    "normalization_bridge_required": true
  },
  "route_controls": {
    "global_registered_route_registry_modified": false,
    "proposal_registry_separate": true,
    "may_register_route": false,
    "may_adjudicate": false,
    "may_issue_cert_output": false,
    "may_mark_target_proved": false,
    "aggregate_route_prohibited": true,
    "may_promote_claim": false
  },
  "activation": {
    "condition": "exact-head Cert checks, GCL policy/security, protected CodeQL/no-new-alert precedent, fresh non-author sphere-packing/Lean specialist APPROVED review, explicit exact-head Human Steward disposition, ordinary expected-head merge, and protected-main readback",
    "head_change_requires_reapproval": true,
    "effect": "one_sphere_packing_route_proposal_admitted_no_registration_no_adjudication"
  },
  "candidate_disposition": "A_CERT_ROUTE_PROPOSAL_CLEAR__REGISTRATION_NOT_YET_AUTHORIZED",
  "claim_boundary": "This successor registry admits only one proposed OTP-A-SPHERE-PACKING route after protected activation. It does not modify the global registered-route registry, register MC-ROUTE-OTP-A-SPHERE-PACKING, authorize or execute adjudication, issue a Cert output, mark a target proved, broaden source attribution, erase protected semantic qualifications, create another-family or aggregate OpenAI Ten Proofs authority, or authorize mathematical truth, novelty, priority, publication, patentability, product, or commercial claims."
}
